{
  "$schema": "https://json-schema.org/draft/2020-12/schema",
  "$id": "https://forge-contracts.amerzel.dev/encounter_change_set.v1.schema.json",
  "title": "encounter_change_set.v1",
  "description": "Change set emitted by EncounterComposer after mutating encounter artifacts for a zone.",
  "type": "object",
  "additionalProperties": false,
  "required": [
    "schema",
    "operation",
    "zone_ref",
    "timestamp",
    "changes"
  ],
  "properties": {
    "schema": {
      "const": "encounter_change_set.v1"
    },
    "operation": {
      "type": "string",
      "description": "The mutation operation performed, e.g. create, update, delete, batch-create, scatter, apply-overlay.",
      "minLength": 1
    },
    "zone_ref": {
      "type": "string",
      "minLength": 1
    },
    "timestamp": {
      "type": "string",
      "format": "date-time"
    },
    "run_id": {
      "type": ["string", "null"]
    },
    "producer": {
      "$ref": "#/$defs/producer"
    },
    "changes": {
      "type": "array",
      "items": {
        "$ref": "#/$defs/changeEntry"
      }
    },
    "meta": {
      "$ref": "#/$defs/meta"
    }
  },
  "$defs": {
    "changeEntry": {
      "type": "object",
      "additionalProperties": false,
      "required": [
        "artifact_id",
        "action"
      ],
      "properties": {
        "artifact_id": {
          "type": "string",
          "minLength": 1
        },
        "action": {
          "type": "string",
          "minLength": 1
        },
        "summary": {
          "type": "string"
        }
      }
    },
    "producer": {
      "type": "object",
      "description": "Identifies the tool that generated this document.",
      "additionalProperties": false,
      "required": [
        "tool",
        "version",
        "generatedAt"
      ],
      "properties": {
        "tool": {
          "type": "string",
          "minLength": 1
        },
        "version": {
          "type": "string",
          "minLength": 1
        },
        "generatedAt": {
          "type": "string",
          "description": "ISO 8601 timestamp of generation."
        }
      }
    },
    "meta": {
      "type": "object",
      "additionalProperties": false,
      "properties": {
        "description": {
          "type": "string"
        },
        "extensions": {
          "type": "object",
          "description": "Tool-specific extension metadata. Keyed by tool name. Consumers MUST ignore unknown keys.",
          "additionalProperties": true
        }
      }
    }
  }
}
